Name;IdName;FolderName;Type;ViewMode;RWin;DataOrg;bReciprocal;bSigned;bDelta;bPercent;bOriginal;bOriginalValues;Columns;Rows;Radix;Comment;Precision;SkipBytes;LineSkipBytes;Fieldvalues.Name;Fieldvalues.Unit;Fieldvalues.Factor;Fieldvalues.Offset;Fieldvalues.StartAddr;AxisX.Name;AxisX.IdName;AxisX.Unit;AxisX.Factor;AxisX.Offset;AxisX.Radix;AxisX.bBackwards;AxisX.bReciprocal;AxisX.bSigned;AxisX.Precision;AxisX.DataSrc;AxisX.DataHeader;AxisX.DataAddr;AxisX.DataOrg;AxisX.SignatureByte;AxisX.SkipBytes;AxisY.Name;AxisY.IdName;AxisY.Unit;AxisY.Factor;AxisY.Offset;AxisY.Radix;AxisY.bBackwards;AxisY.bReciprocal;AxisY.bSigned;AxisY.Precision;AxisY.DataSrc;AxisY.DataHeader;AxisY.DataAddr;AxisY.DataOrg;AxisY.SignatureByte;AxisY.SkipBytes
Prozentuale Aenderung der Ueberschneidungszeit abhaengig von der Mechatroniktemperatur;KhsUeb_Fakt_Temp_kl;KhsApplUeberschneidung: ""Applikationsgrößen für die Überschneidung"";eEindim;eViewText;eBars;eHiLo;0;1;0;0;0;0;5;1;10;;0;0;0;;%;1;0;$186E6;Temperatur;;°C;1;0;10;0;0;1;0;eRom;0;$186DC;eHiLo;0x-1;0;-;;-;1;0;16;1;0;0;-1;eDataSrcNone;0;$0;eByte;0x-1;0
Momentenverteilung auf die gehende Kupplung während der Überschneidung;KhsUeb_FaktorGehend_kl.AMax;KhsApplUeberschneidung: ""Applikationsgrößen für die Überschneidung"";eEindim;eViewText;eBars;eHiLo;0;1;0;0;0;0;6;1;10;;1;0;0;Faktor 2^-10 in Prozent;%;0.09765625;-0;$186C4;Faktor 2^-10 in Prozent;;%;0.09765625;-0;10;0;0;1;1;eRom;0;$18694;eHiLo;0x-1;0;-;;-;1;0;16;1;0;0;-1;eDataSrcNone;0;$0;eByte;0x-1;0
Momentenverteilung auf die gehende Kupplung während der Überschneidung;KhsUeb_FaktorGehend_kl.EEK;KhsApplEek: ""Applikationsparameter für die Eek-Funktionalität"";eEindim;eViewText;eBars;eHiLo;0;1;0;0;0;0;6;1;10;;1;0;0;Faktor 2^-10 in Prozent;%;0.09765625;-0;$186D0;Faktor 2^-10 in Prozent;;%;0.09765625;-0;10;0;0;1;1;eRom;0;$18694;eHiLo;0x-1;0;-;;-;1;0;16;1;0;0;-1;eDataSrcNone;0;$0;eByte;0x-1;0
Momentenverteilung auf die gehende Kupplung während der Überschneidung;KhsUeb_FaktorGehend_kl.Eco;KhsApplUeberschneidung: ""Applikationsgrößen für die Überschneidung"";eEindim;eViewText;eBars;eHiLo;0;1;0;0;0;0;6;1;10;;1;0;0;Faktor 2^-10 in Prozent;%;0.09765625;-0;$186A0;Faktor 2^-10 in Prozent;;%;0.09765625;-0;10;0;0;1;1;eRom;0;$18694;eHiLo;0x-1;0;-;;-;1;0;16;1;0;0;-1;eDataSrcNone;0;$0;eByte;0x-1;0
Momentenverteilung auf die gehende Kupplung während der Überschneidung;KhsUeb_FaktorGehend_kl.Sport;KhsApplUeberschneidung: ""Applikationsgrößen für die Überschneidung"";eEindim;eViewText;eBars;eHiLo;0;1;0;0;0;0;6;1;10;;1;0;0;Faktor 2^-10 in Prozent;%;0.09765625;-0;$186AC;Faktor 2^-10 in Prozent;;%;0.09765625;-0;10;0;0;1;1;eRom;0;$18694;eHiLo;0x-1;0;-;;-;1;0;16;1;0;0;-1;eDataSrcNone;0;$0;eByte;0x-1;0
Momentenverteilung auf die gehende Kupplung während der Überschneidung;KhsUeb_FaktorGehend_kl.Tip;KhsApplUeberschneidung: ""Applikationsgrößen für die Überschneidung"";eEindim;eViewText;eBars;eHiLo;0;1;0;0;0;0;6;1;10;;1;0;0;Faktor 2^-10 in Prozent;%;0.09765625;-0;$186B8;Faktor 2^-10 in Prozent;;%;0.09765625;-0;10;0;0;1;1;eRom;0;$18694;eHiLo;0x-1;0;-;;-;1;0;16;1;0;0;-1;eDataSrcNone;0;$0;eByte;0x-1;0
Momentengradient zum Oeffnen der gehenden Kupplung am Ende der Ueberschneidung;KhsUeb_MKupGrad_Oeffnen_kf;KhsApplUeberschneidung: ""Applikationsgrößen für die Überschneidung"";eZweidim;eViewText;eBars;eHiLo;0;1;0;0;0;0;5;5;10;;2;0;0;Momenten-Gradient in Nm/10ms;Nm/10ms;0.05;-0;$1870E;Motor/Kupplungsmoment;;Nm;0.05;-0;10;0;0;1;2;eRom;0;$186FA;eHiLo;0x-1;0;Temperatur;;°C;1;0;10;0;0;1;0;eRom;0;$116D8;eHiLo;0x-1;0
Gibt an zu wieviel Prozent das “Kalt-Kennfeld“ in Berechnung mit einfliesst (OPL_2821);KhsUeb_Proz_Kalt_kl;KhsApplUeberschneidung: ""Applikationsgrößen für die Überschneidung"";eEindim;eViewText;eBars;eHiLo;0;1;0;0;0;0;5;1;10;;1;0;0;Auflösung 0.1%;%;0.1;-0;$186F0;Temperatur;;°C;1;0;10;0;0;1;0;eRom;0;$186DC;eHiLo;0x-1;0;-;;-;1;0;16;1;0;0;-1;eDataSrcNone;0;$0;eByte;0x-1;0
Maximale Momentenänderung an der kommenden Kupplung während der Überschneidung;Khs_DMKommendUeberMax_ko;KhsApplUeberschneidung: ""Applikationsgrößen für die Überschneidung"";eEinzel;eViewText;eBars;eHiLo;0;1;0;0;0;0;1;1;10;;0;0;0;Momenten-Gradient in Nm/sec;Nm/sec;5;-0;$1874A;-;;-;1;0;16;1;0;0;-1;eDataSrcNone;0;$0;eByte;0x-1;0;-;;-;1;0;16;1;0;0;-1;eDataSrcNone;0;$0;eByte;0x-1;0
Minimale Momentenänderung an der kommenden Kupplung während der Überschneidung;Khs_DMKommendUeberMin_ko;KhsApplUeberschneidung: ""Applikationsgrößen für die Überschneidung"";eEinzel;eViewText;eBars;eHiLo;0;1;0;0;0;0;1;1;10;;0;0;0;Momenten-Gradient in Nm/sec;Nm/sec;5;-0;$18748;-;;-;1;0;16;1;0;0;-1;eDataSrcNone;0;$0;eByte;0x-1;0;-;;-;1;0;16;1;0;0;-1;eDataSrcNone;0;$0;eByte;0x-1;0
Kennlinie fuer temperaturabhaengige Schaltzeitkorrektur;Khs_FaktSchaltzeitKorr_kl;KhsApplSchaltzeit: ""Applikationsparameter für die Schaltzeiten"";eEindim;eViewText;eBars;eHiLo;0;1;0;0;0;0;4;1;10;;0;0;0;;%;1;0;$18412;Temperatur;;°C;1;0;10;0;0;1;0;eRom;0;$1840A;eHiLo;0x-1;0;-;;-;1;0;16;1;0;0;-1;eDataSrcNone;0;$0;eByte;0x-1;0
Moment auf der gehenden Kupplung, ab dem die Überschneidung beendet wird;Khs_MGehendEndeUeb_ko;KhsApplUeberschneidung: ""Applikationsgrößen für die Überschneidung"";eEinzel;eViewText;eBars;eHiLo;0;1;0;0;0;0;1;1;10;;2;0;0;Motor/Kupplungsmoment;Nm;0.05;-0;$1874C;-;;-;1;0;16;1;0;0;-1;eDataSrcNone;0;$0;eByte;0x-1;0;-;;-;1;0;16;1;0;0;-1;eDataSrcNone;0;$0;eByte;0x-1;0
Mindestgradient für die Rampe beim Öffnen der gehenden Kupplung nach der Überschneidung;Khs_MGradMin_ko;KhsApplUeberschneidung: ""Applikationsgrößen für die Überschneidung"";eEinzel;eViewText;eBars;eHiLo;0;1;0;0;0;0;1;1;10;;0;0;0;Momenten-Gradient in Nm/sec;Nm/sec;5;-0;$18744;-;;-;1;0;16;1;0;0;-1;eDataSrcNone;0;$0;eByte;0x-1;0;-;;-;1;0;16;1;0;0;-1;eDataSrcNone;0;$0;eByte;0x-1;0
Differenzmoment der Kupplungen, unterhalb dem die Ueberschneidung beschleunigt wird;Khs_MUeberGrenz_ko;KhsApplUeberschneidung: ""Applikationsgrößen für die Überschneidung"";eEinzel;eViewText;eBars;eHiLo;0;1;0;0;0;0;1;1;10;;2;0;0;Motor/Kupplungsmoment;Nm;0.05;-0;$18746;-;;-;1;0;16;1;0;0;-1;eDataSrcNone;0;$0;eByte;0x-1;0;-;;-;1;0;16;1;0;0;-1;eDataSrcNone;0;$0;eByte;0x-1;0
Modus für die Unterscheidung Schub/Zug bei der Schaltzeitbestimmung;Khs_Modus_TSchaltSchub_ko;KhsApplSchaltzeit: ""Applikationsparameter für die Schaltzeiten"";eEinzel;eViewText;eBars;eByte;0;0;0;0;0;0;1;1;10;;1;0;0;Modus fuer die Unterscheidung Schub/Zug bei der Schaltzeitbestimmung;;1;0;$1856E;-;;-;1;0;16;1;0;0;-1;eDataSrcNone;0;$0;eByte;0x-1;0;-;;-;1;0;16;1;0;0;-1;eDataSrcNone;0;$0;eByte;0x-1;0
Schaltzeiten in D (Eco) im Schub, wird in Abhängigkeit von Khs_Modus_TSchaltSchub_ko verwendet;Khs_TiSchaltNDiff_EcoSchub_kl;KhsApplSchaltzeit: ""Applikationsparameter für die Schaltzeiten"";eZweidim;eViewText;eBars;eHiLo;0;1;0;0;0;0;5;6;10;;1;0;0;;ms;1;0;$1819E;Drehzahl;;U/min;1;0;10;0;0;1;0;eRom;0;$18158;eHiLo;0x-1;0;Gänge Hochschaltung;Khs.GangLetzt;;1;1;10;0;0;0;0;eUserdefString;0;$0;eByte;0x-1;0
Schaltzeiten in D (Eco);Khs_TiSchaltNDiff_Eco_kl;KhsApplSchaltzeit: ""Applikationsparameter für die Schaltzeiten"";eZweidim;eViewText;eBars;eHiLo;0;1;0;0;0;0;5;6;10;;1;0;0;;ms;1;0;$18162;Drehzahl;;U/min;1;0;10;0;0;1;0;eRom;0;$18158;eHiLo;0x-1;0;Gänge Hochschaltung;Khs.GangLetzt;;1;1;10;0;0;0;0;eUserdefString;0;$0;eByte;0x-1;0
Schaltzeiten in D (Eco) bei RoughRoad;Khs_TiSchaltNDiff_Rrd_kl;KhsApplSchaltzeit: ""Applikationsparameter für die Schaltzeiten"";eZweidim;eViewText;eBars;eHiLo;0;1;0;0;0;0;5;6;10;;1;0;0;;ms;1;0;$182CA;Drehzahl;;U/min;1;0;10;0;0;1;0;eRom;0;$18158;eHiLo;0x-1;0;Gänge Hochschaltung;Khs.GangLetzt;;1;1;10;0;0;0;0;eUserdefString;0;$0;eByte;0x-1;0
Schaltzeiten in S (Sport) im Schub, wird in Abhängigkeit von Khs_Modus_TSchaltSchub_ko verwendet;Khs_TiSchaltNDiff_SportSchub_kl;KhsApplSchaltzeit: ""Applikationsparameter für die Schaltzeiten"";eZweidim;eViewText;eBars;eHiLo;0;1;0;0;0;0;5;6;10;;1;0;0;;ms;1;0;$18216;Drehzahl;;U/min;1;0;10;0;0;1;0;eRom;0;$18158;eHiLo;0x-1;0;Gänge Hochschaltung;Khs.GangLetzt;;1;1;10;0;0;0;0;eUserdefString;0;$0;eByte;0x-1;0
Schaltzeiten in S (Sport);Khs_TiSchaltNDiff_Sport_kl;KhsApplSchaltzeit: ""Applikationsparameter für die Schaltzeiten"";eZweidim;eViewText;eBars;eHiLo;0;1;0;0;0;0;5;6;10;;1;0;0;;ms;1;0;$181DA;Drehzahl;;U/min;1;0;10;0;0;1;0;eRom;0;$18158;eHiLo;0x-1;0;Gänge Hochschaltung;Khs.GangLetzt;;1;1;10;0;0;0;0;eUserdefString;0;$0;eByte;0x-1;0
Schaltzeiten in Tiptronic im Schub, wird in Abhängigkeit von Khs_Modus_TSchaltSchub_ko verwendet;Khs_TiSchaltNDiff_TipSchub_kl;KhsApplSchaltzeit: ""Applikationsparameter für die Schaltzeiten"";eZweidim;eViewText;eBars;eHiLo;0;1;0;0;0;0;5;6;10;;1;0;0;;ms;1;0;$1828E;Drehzahl;;U/min;1;0;10;0;0;1;0;eRom;0;$18158;eHiLo;0x-1;0;Gänge Hochschaltung;Khs.GangLetzt;;1;1;10;0;0;0;0;eUserdefString;0;$0;eByte;0x-1;0
Schaltzeiten in Tiptronic;Khs_TiSchaltNDiff_Tip_kl;KhsApplSchaltzeit: ""Applikationsparameter für die Schaltzeiten"";eZweidim;eViewText;eBars;eHiLo;0;1;0;0;0;0;5;6;10;;1;0;0;;ms;1;0;$18252;Drehzahl;;U/min;1;0;10;0;0;1;0;eRom;0;$18158;eHiLo;0x-1;0;Gänge Hochschaltung;Khs.GangLetzt;;1;1;10;0;0;0;0;eUserdefString;0;$0;eByte;0x-1;0
per Applikation begrenzbarer Zustellgradient fuer Kup1;KhsdMRampeSchnelleUe_ko[K1];KhsApplUeberschneidung: ""Applikationsgrößen für die Überschneidung"";eEinzel;eViewText;eBars;eHiLo;0;1;0;0;0;0;1;1;10;;2;0;0;Momenten-Gradient in Nm/10ms;Nm/10ms;0.05;-0;$18740;-;;-;1;0;16;1;0;0;-1;eDataSrcNone;0;$0;eByte;0x-1;0;-;;-;1;0;16;1;0;0;-1;eDataSrcNone;0;$0;eByte;0x-1;0
per Applikation begrenzbarer Zustellgradient fuer Kup2;KhsdMRampeSchnelleUe_ko[K2];KhsApplUeberschneidung: ""Applikationsgrößen für die Überschneidung"";eEinzel;eViewText;eBars;eHiLo;0;1;0;0;0;0;1;1;10;;2;0;0;Momenten-Gradient in Nm/10ms;Nm/10ms;0.05;-0;$18742;-;;-;1;0;16;1;0;0;-1;eDataSrcNone;0;$0;eByte;0x-1;0;-;;-;1;0;16;1;0;0;-1;eDataSrcNone;0;$0;eByte;0x-1;0
Interpolationskurve wenn MP_INTERPOLATION_NICHT_LINEAR = 1;MP_INTERPOL_KURVE;DSP_MP: ""Motorschutz über Temperatur mit MPSLTAB"";eEindim;eViewText;eBars;eByte;0;0;0;0;0;0;17;1;10;;2;0;0;;;1;0;$9832;MP_INTERPOL_KURVE_X_AXIS.CONVERSION;;;1;0;10;0;0;0;2;eDataSrcNone;0;$0;eByte;0x-1;0;-;;-;1;0;16;1;0;0;-1;eDataSrcNone;0;$0;eByte;0x-1;0
Modusbyte zum Synchronisieren der Signalkanäle;Sgn_ModusSynchron_ko;SGN_Parameter: ""Parameter des Signalgenerators"";eEinzel;eViewText;eBars;eByte;0;0;0;0;0;0;1;1;10;;1;0;0;;;1;0;$5C1E;-;;-;1;0;16;1;0;0;-1;eDataSrcNone;0;$0;eByte;0x-1;0;-;;-;1;0;16;1;0;0;-1;eDataSrcNone;0;$0;eByte;0x-1;0
Auswahl der Signalform;Sgn_Signalform_ko_2;SGN_Parameter: ""Parameter des Signalgenerators"";eEinzel;eViewText;eBars;eByte;0;0;0;0;0;0;1;1;10;;3;0;0;Signalgeneratortypen;;1;0;$5C1B;-;;-;1;0;16;1;0;0;-1;eDataSrcNone;0;$0;eByte;0x-1;0;-;;-;1;0;16;1;0;0;-1;eDataSrcNone;0;$0;eByte;0x-1;0
Auswahl der Signalform;Sgn_Signalform_ko_3;SGN_Parameter: ""Parameter des Signalgenerators"";eEinzel;eViewText;eBars;eByte;0;0;0;0;0;0;1;1;10;;3;0;0;Signalgeneratortypen;;1;0;$5C1C;-;;-;1;0;16;1;0;0;-1;eDataSrcNone;0;$0;eByte;0x-1;0;-;;-;1;0;16;1;0;0;-1;eDataSrcNone;0;$0;eByte;0x-1;0
Auswahl der Signalform;Sgn_Signalform_ko_4;SGN_Parameter: ""Parameter des Signalgenerators"";eEinzel;eViewText;eBars;eByte;0;0;0;0;0;0;1;1;10;;3;0;0;Signalgeneratortypen;;1;0;$5C1D;-;;-;1;0;16;1;0;0;-1;eDataSrcNone;0;$0;eByte;0x-1;0;-;;-;1;0;16;1;0;0;-1;eDataSrcNone;0;$0;eByte;0x-1;0
TG-Solldruck in Abhaengigkeit der Temperatur fuer Kupplungsmoment oberhalb Schwelle (OPL_2916);Tds_PTg_UeberSchwelle_kl;TDS_Parameter: ""Parameter Teilgetriebedrucksteuerung"";eEindim;eViewText;eBars;eHiLo;0;1;0;0;0;0;6;1;10;;2;0;0;Druck;bar;0.01;-0;$5C20;Temperatur;;°C;1;0;10;0;0;1;0;eRom;0;$5C38;eHiLo;0x-1;0;-;;-;1;0;16;1;0;0;-1;eDataSrcNone;0;$0;eByte;0x-1;0
Zu sperrende Gänge bei Hochaltverhinderung;Fsi_MaskFehKeineHochschaltung_ko;FSI_Parameter: """";eEinzel;eViewText;eBars;eHiLo;0;0;0;0;0;0;1;1;10;;2;0;0;;;1;0;$5C58;-;;-;1;0;16;1;0;0;-1;eDataSrcNone;0;$0;eByte;0x-1;0;-;;-;1;0;16;1;0;0;-1;eDataSrcNone;0;$0;eByte;0x-1;0
manuelle Vorgabe des Sollgangs;Ges_ManVorgabe_GangSoll_ko;Manuell: """";eEinzel;eViewText;eBars;eByte;0;0;0;0;0;0;1;1;10;;1;0;0;;;1;0;$5C5A;-;;-;1;0;16;1;0;0;-1;eDataSrcNone;0;$0;eByte;0x-1;0;-;;-;1;0;16;1;0;0;-1;eDataSrcNone;0;$0;eByte;0x-1;0
manuelle Vorgabe des Vorgabegangs;Ges_ManVorgabe_GangVowahl_ko;Manuell: """";eEinzel;eViewText;eBars;eByte;0;0;0;0;0;0;1;1;10;;1;0;0;;;1;0;$5C5B;-;;-;1;0;16;1;0;0;-1;eDataSrcNone;0;$0;eByte;0x-1;0;-;;-;1;0;16;1;0;0;-1;eDataSrcNone;0;$0;eByte;0x-1;0
Maximal zulässige Motordrehzahl für manuelle Gangvorgabe;Ges_ManVorgabe_NMotorMax_ko;Manuell: """";eEinzel;eViewText;eBars;eHiLo;0;1;0;0;0;0;1;1;10;;0;0;0;Drehzahl;U/min;1;0;$5C5C;-;;-;1;0;16;1;0;0;-1;eDataSrcNone;0;$0;eByte;0x-1;0;-;;-;1;0;16;1;0;0;-1;eDataSrcNone;0;$0;eByte;0x-1;0
Modus zum Bestimmen der Gangberechnung im Notfahren;Ges_Modus_GangNot_ko;Ges_Parameter: """";eEinzel;eViewText;eBars;eByte;0;0;0;0;0;0;1;1;10;;1;0;0;;;1;0;$5C5E;-;;-;1;0;16;1;0;0;-1;eDataSrcNone;0;$0;eByte;0x-1;0;-;;-;1;0;16;1;0;0;-1;eDataSrcNone;0;$0;eByte;0x-1;0
Drehzahloffset auf Eingangswellendrehzahl für Sollmotordrehzahl im Schub (Mikroschlupf);Kas_NEwOfs_Schub_ko;KasApp_Solldrehzahlgenerierung: ""Applikationsparameter Solldrehzahlgenerierung"";eEinzel;eViewText;eBars;eHiLo;0;1;0;0;0;0;1;1;10;;0;0;0;Drehzahl;U/min;1;0;$5C60;-;;-;1;0;16;1;0;0;-1;eDataSrcNone;0;$0;eByte;0x-1;0;-;;-;1;0;16;1;0;0;-1;eDataSrcNone;0;$0;eByte;0x-1;0
Drehzahl auf Eingangswelle im Zug (Mikroschlupf);Kas_NEwOfs_Zug_ko;KasApp_Solldrehzahlgenerierung: ""Applikationsparameter Solldrehzahlgenerierung"";eEinzel;eViewText;eBars;eHiLo;0;1;0;0;0;0;1;1;10;;0;0;0;Drehzahl;U/min;1;0;$5C66;-;;-;1;0;16;1;0;0;-1;eDataSrcNone;0;$0;eByte;0x-1;0;-;;-;1;0;16;1;0;0;-1;eDataSrcNone;0;$0;eByte;0x-1;0
PT_1 Filterkonstante für die Filterung des Abbaus der Verschleifdrehzahl;Kas_NVerschlFil_Filko_ko;KasApp_Solldrz_Verschleifen: ""Solldrehzahlvorgabe für Annäherung an die Wellendrehzahl"";eEinzel;eViewText;eBars;eHiLo;0;1;0;0;0;0;1;1;10;;1;0;0;;;1;0;$5C62;-;;-;1;0;16;1;0;0;-1;eDataSrcNone;0;$0;eByte;0x-1;0;-;;-;1;0;16;1;0;0;-1;eDataSrcNone;0;$0;eByte;0x-1;0
PT_1 Filterkonstante für die Filterung des Abbaus der Verschleifdrehzahl bei LC-Anfahrt (-1 bedeutet Default-Faktor!);Kas_NVerschlFil_Filko_ko[LC];KasApp_Solldrz_Verschleifen: ""Solldrehzahlvorgabe für Annäherung an die Wellendrehzahl"";eEinzel;eViewText;eBars;eHiLo;0;1;0;0;0;0;1;1;10;;1;0;0;;;1;0;$5C64;-;;-;1;0;16;1;0;0;-1;eDataSrcNone;0;$0;eByte;0x-1;0;-;;-;1;0;16;1;0;0;-1;eDataSrcNone;0;$0;eByte;0x-1;0
Drehzahlgradient für Aufbau Motordrehzahl auf Stalldrehzahl in ACC;Kas_dNStallSoll_MaxACC_kl;KasApp_Solldrz_Sollgradient: ""Vorgabe des Solldrehzahlgradienten zu Beginn der Anfahrt"";eEindim;eViewText;eBars;eHiLo;0;1;0;0;0;0;5;1;10;;1;0;0;;U/min/sec;1;0;$60AC;Fahrpedal;;%;0.1;-0;10;0;0;1;1;eRom;0;$5C68;eHiLo;0x-1;0;-;;-;1;0;16;1;0;0;-1;eDataSrcNone;0;$0;eByte;0x-1;0
Drehzahlgradient für Aufbau Motordrehzahl auf Stalldrehzahl Gang 2 (Stützstelle 0/0 negativ bedatet dient zum Deaktivieren des Kennfelds);Kas_dNStallSoll_Max_G2_kf;KasApp_Solldrz_Sollgradient: ""Vorgabe des Solldrehzahlgradienten zu Beginn der Anfahrt"";eZweidim;eViewText;eBars;eHiLo;0;1;0;0;0;0;5;5;10;;1;0;0;;U/min/sec;1;0;$6042;Fahrpedalgradient;Kas_FPGrdMax;%/sec;0.1;-0;10;0;0;1;0;eRom;0;$5C74;eHiLo;0x-1;0;Fahrpedal;;%;0.1;-0;10;0;0;1;1;eRom;0;$5C68;eHiLo;0x-1;0
Drehzahlgradient für Aufbau Motordrehzahl auf Stalldrehzahl in WH-Position Tip/S Gang 2 (Stützstelle 0/0 negativ bedatet dient zum Deaktivieren des Kennfelds);Kas_dNStallSoll_Max_TipS_G2_kf;KasApp_Solldrz_Sollgradient: ""Vorgabe des Solldrehzahlgradienten zu Beginn der Anfahrt"";eZweidim;eViewText;eBars;eHiLo;0;1;0;0;0;0;5;5;10;;1;0;0;;U/min/sec;1;0;$6010;Fahrpedalgradient;Kas_FPGrdMax;%/sec;0.1;-0;10;0;0;1;0;eRom;0;$5C74;eHiLo;0x-1;0;Fahrpedal;;%;0.1;-0;10;0;0;1;1;eRom;0;$5C68;eHiLo;0x-1;0
Drehzahlgradient für Aufbau Motordrehzahl auf Stalldrehzahl in WH-Position Tip/S Gang 1 (Stützstelle 0/0 negativ bedatet dient zum Deaktivieren des Kennfelds);Kas_dNStallSoll_Max_TipS_kf;KasApp_Solldrz_Sollgradient: ""Vorgabe des Solldrehzahlgradienten zu Beginn der Anfahrt"";eZweidim;eViewText;eBars;eHiLo;0;1;0;0;0;0;5;5;10;;1;0;0;;U/min/sec;1;0;$5F9C;Fahrpedalgradient;Kas_FPGrdMax;%/sec;0.1;-0;10;0;0;1;0;eRom;0;$5C74;eHiLo;0x-1;0;Fahrpedal;;%;0.1;-0;10;0;0;1;1;eRom;0;$5C68;eHiLo;0x-1;0
Drehzahlgradient für Aufbau Motordrehzahl auf Stalldrehzahl;Kas_dNStallSoll_Max_kf;KasApp_Solldrz_Sollgradient: ""Vorgabe des Solldrehzahlgradienten zu Beginn der Anfahrt"";eZweidim;eViewText;eBars;eHiLo;0;1;0;0;0;0;5;5;10;;1;0;0;;U/min/sec;1;0;$5C7E;Fahrpedalgradient;Kas_FPGrdMax;%/sec;0.1;-0;10;0;0;1;0;eRom;0;$5C74;eHiLo;0x-1;0;Fahrpedal;;%;0.1;-0;10;0;0;1;1;eRom;0;$5C68;eHiLo;0x-1;0
max. Gradient des Reglermomentes  i.A. des Kupplungsdruckes von K1;KrsGr_DmLimitMinP_kl[K1];KrsApplSollgradient: ""Applikation Sollgradient für  Drehzahl/Gradientenregler"";eEindim;eViewText;eBars;eHiLo;0;1;0;0;0;0;4;1;10;;1;0;0;;Nm/10ms;0.05;-0;$20EAA;Hauptdruck in bar;;bar;0.01;-0;10;0;0;1;2;eRom;0;$20EA2;eHiLo;0x-1;0;-;;-;1;0;16;1;0;0;-1;eDataSrcNone;0;$0;eByte;0x-1;0
max. Gradient des Reglermomentes  i.A. des Kupplungsdruckes von K2;KrsGr_DmLimitMinP_kl[K2];KrsApplSollgradient: ""Applikation Sollgradient für  Drehzahl/Gradientenregler"";eEindim;eViewText;eBars;eHiLo;0;1;0;0;0;0;4;1;10;;1;0;0;;Nm/10ms;0.05;-0;$20EB2;Hauptdruck in bar;;bar;0.01;-0;10;0;0;1;2;eRom;0;$20EA2;eHiLo;0x-1;0;-;;-;1;0;16;1;0;0;-1;eDataSrcNone;0;$0;eByte;0x-1;0
max. Sollgradient fuer Einfach-Rueckschaltungen im Economic-Betrieb (OPL_2642);KrsNpMaxEco_kf;KrsApplSollgradient: ""Applikation Sollgradient für  Drehzahl/Gradientenregler"";eZweidim;eViewText;eBars;eHiLo;0;1;0;0;0;0;5;6;10;;0;0;0;Drehzahlgradient in U/min/s;U/min/s;1;0;$20BBE;Motor/Kupplungsmoment;;Nm;0.05;-0;10;0;0;1;2;eRom;0;$20AA0;eHiLo;0x-1;0;2.Gang bis hoechsten Gang;NO_INPUT_QUANTITY;;1;0;10;0;0;0;0;eUserdefString;0;$0;eByte;0x-1;0
max. Sollgradient fuer Einfach-Rueckschaltungen bei RRD im Eskalationslevel Quick (OPL_2674, OPL_2642);KrsNpMaxRRD_kf[Quick];KrsApplSollgradient: ""Applikation Sollgradient für  Drehzahl/Gradientenregler"";eZweidim;eViewText;eBars;eHiLo;0;1;0;0;0;0;5;6;10;;0;0;0;Drehzahlgradient;U/min / sec;1;0;$20DC6;Motor/Kupplungsmoment;;Nm;0.05;-0;10;0;0;1;2;eRom;0;$20AA0;eHiLo;0x-1;0;2.Gang bis hoechsten Gang;NO_INPUT_QUANTITY;;1;0;10;0;0;0;0;eUserdefString;0;$0;eByte;0x-1;0
max. Sollgradient fuer Einfach-Rueckschaltungen bei RRD im Eskalationslevel Slow (OPL_2674, OPL_2642);KrsNpMaxRRD_kf[Slow];KrsApplSollgradient: ""Applikation Sollgradient für  Drehzahl/Gradientenregler"";eZweidim;eViewText;eBars;eHiLo;0;1;0;0;0;0;5;6;10;;0;0;0;Drehzahlgradient;U/min / sec;1;0;$20D8A;Motor/Kupplungsmoment;;Nm;0.05;-0;10;0;0;1;2;eRom;0;$20AA0;eHiLo;0x-1;0;2.Gang bis hoechsten Gang;NO_INPUT_QUANTITY;;1;0;10;0;0;0;0;eUserdefString;0;$0;eByte;0x-1;0
max. Sollgradient fuer Einfach-Rueckschaltungen im Sport-Betrieb (OPL_2642);KrsNpMaxSport_kf;KrsApplSollgradient: ""Applikation Sollgradient für  Drehzahl/Gradientenregler"";eZweidim;eViewText;eBars;eHiLo;0;1;0;0;0;0;5;6;10;;0;0;0;Drehzahlgradient in U/min/s;U/min/s;1;0;$20BFA;Motor/Kupplungsmoment;;Nm;0.05;-0;10;0;0;1;2;eRom;0;$20AA0;eHiLo;0x-1;0;2.Gang bis hoechsten Gang;NO_INPUT_QUANTITY;;1;0;10;0;0;0;0;eUserdefString;0;$0;eByte;0x-1;0
max. Sollgradient fuer Einfach-Rueckschaltungen im Tiptronic-Betrieb (OPL_2642);KrsNpMaxTip_kf;KrsApplSollgradient: ""Applikation Sollgradient für  Drehzahl/Gradientenregler"";eZweidim;eViewText;eBars;eHiLo;0;1;0;0;0;0;5;6;10;;0;0;0;Drehzahlgradient in U/min/s;U/min/s;1;0;$20C36;Motor/Kupplungsmoment;;Nm;0.05;-0;10;0;0;1;2;eRom;0;$20AA0;eHiLo;0x-1;0;2.Gang bis hoechsten Gang;NO_INPUT_QUANTITY;;1;0;10;0;0;0;0;eUserdefString;0;$0;eByte;0x-1;0
Mindestgradient des Drehzahlregler über Motormoment ohne Eingriff in S/Tip;KrsNpSollMin_STip_kl;KrsApplSollgradient: ""Applikation Sollgradient für  Drehzahl/Gradientenregler"";eEindim;eViewText;eBars;eHiLo;0;1;0;0;0;0;5;1;10;;0;0;0;Drehzahlgradient in U/min/s;U/min/s;1;0;$20E90;Motor/Kupplungsmoment;;Nm;0.05;-0;10;0;0;1;2;eRom;0;$20E7C;eHiLo;0x-1;0;-;;-;1;0;16;1;0;0;-1;eDataSrcNone;0;$0;eByte;0x-1;0
Mindestgradient des Drehzahlregler über Motormoment ohne Eingriff in D;KrsNpSollMin_kl;KrsApplSollgradient: ""Applikation Sollgradient für  Drehzahl/Gradientenregler"";eEindim;eViewText;eBars;eHiLo;0;1;0;0;0;0;5;1;10;;0;0;0;Drehzahlgradient in U/min/s;U/min/s;1;0;$20E86;Motor/Kupplungsmoment;;Nm;0.05;-0;10;0;0;1;2;eRom;0;$20E7C;eHiLo;0x-1;0;-;;-;1;0;16;1;0;0;-1;eDataSrcNone;0;$0;eByte;0x-1;0
relativer Sprung des Sollgradienten bei erster Initialisierung;KrsNpSprungInitRel_kf;KrsApplSollgradient: ""Applikation Sollgradient für  Drehzahl/Gradientenregler"";eZweidim;eViewText;eBars;eHiLo;0;1;0;0;0;0;5;5;10;;1;0;0;;%;0.1;-0;$20E18;Motor/Kupplungsmoment;;Nm;0.05;-0;10;0;0;1;2;eRom;0;$20E04;eHiLo;0x-1;0;Drehzahl in U/min;;U/min;1;0;10;0;0;1;0;eRom;0;$20E0E;eHiLo;0x-1;0
relativer Sprung des Sollgradienten bei Neuinitialisierung;KrsNpSprungRel_kf;KrsApplSollgradient: ""Applikation Sollgradient für  Drehzahl/Gradientenregler"";eZweidim;eViewText;eBars;eHiLo;0;1;0;0;0;0;5;5;10;;1;0;0;;%;0.1;-0;$20E4A;Motor/Kupplungsmoment;;Nm;0.05;-0;10;0;0;1;2;eRom;0;$20E04;eHiLo;0x-1;0;Drehzahl in U/min;;U/min;1;0;10;0;0;1;0;eRom;0;$20E0E;eHiLo;0x-1;0
maximale Schaltzeiten fuer Rueckschaltungen im Economic-Betrieb (OPL_2642);KrsSchaltzeitEco_kf;KrsApplSollgradient: ""Applikation Sollgradient für  Drehzahl/Gradientenregler"";eZweidim;eViewText;eBars;eHiLo;0;1;0;0;0;0;5;6;10;;1;0;0;;ms;1;0;$20AF6;Motor/Kupplungsmoment;;Nm;0.05;-0;10;0;0;1;2;eRom;0;$20AA0;eHiLo;0x-1;0;2.Gang bis hoechsten Gang;NO_INPUT_QUANTITY;;1;0;10;0;0;0;0;eUserdefString;0;$0;eByte;0x-1;0
maximale Schaltzeiten fuer Rueckschaltungen bei RRD im Eskalationslevel Quick (OPL_2674, OPL_2642);KrsSchaltzeitRRD_kf[Quick];KrsApplSollgradient: ""Applikation Sollgradient für  Drehzahl/Gradientenregler"";eZweidim;eViewText;eBars;eHiLo;0;1;0;0;0;0;5;6;10;;0;0;0;ms in Auflösung 1 ms;ms;1;0;$20D4E;Motor/Kupplungsmoment;;Nm;0.05;-0;10;0;0;1;2;eRom;0;$20AA0;eHiLo;0x-1;0;2.Gang bis hoechsten Gang;NO_INPUT_QUANTITY;;1;0;10;0;0;0;0;eUserdefString;0;$0;eByte;0x-1;0
maximale Schaltzeiten fuer Rueckschaltungen bei RRD im Eskalationslevel Slow (OPL_2674, OPL_2642);KrsSchaltzeitRRD_kf[Slow];KrsApplSollgradient: ""Applikation Sollgradient für  Drehzahl/Gradientenregler"";eZweidim;eViewText;eBars;eHiLo;0;1;0;0;0;0;5;6;10;;0;0;0;ms in Auflösung 1 ms;ms;1;0;$20D12;Motor/Kupplungsmoment;;Nm;0.05;-0;10;0;0;1;2;eRom;0;$20AA0;eHiLo;0x-1;0;2.Gang bis hoechsten Gang;NO_INPUT_QUANTITY;;1;0;10;0;0;0;0;eUserdefString;0;$0;eByte;0x-1;0
maximale Schaltzeiten fuer Rueckschaltungen im Sport-Betrieb (OPL_2642);KrsSchaltzeitSport_kf;KrsApplSollgradient: ""Applikation Sollgradient für  Drehzahl/Gradientenregler"";eZweidim;eViewText;eBars;eHiLo;0;1;0;0;0;0;5;6;10;;1;0;0;;ms;1;0;$20B32;Motor/Kupplungsmoment;;Nm;0.05;-0;10;0;0;1;2;eRom;0;$20AA0;eHiLo;0x-1;0;2.Gang bis hoechsten Gang;NO_INPUT_QUANTITY;;1;0;10;0;0;0;0;eUserdefString;0;$0;eByte;0x-1;0
maximale Schaltzeiten fuer Rueckschaltungen fuer Tiptronic-Betrieb (OPL_2642);KrsSchaltzeitTip_kf;KrsApplSollgradient: ""Applikation Sollgradient für  Drehzahl/Gradientenregler"";eZweidim;eViewText;eBars;eHiLo;0;1;0;0;0;0;5;6;10;;1;0;0;;ms;1;0;$20ABA;Motor/Kupplungsmoment;;Nm;0.05;-0;10;0;0;1;2;eRom;0;$20AA0;eHiLo;0x-1;0;2.Gang bis hoechsten Gang;NO_INPUT_QUANTITY;;1;0;10;0;0;0;0;eUserdefString;0;$0;eByte;0x-1;0
Offset auf die Zieldrehzahl zur Berechnung des Sollgradienten aus dem Drehzahlregler und Fortschrittsüberwachung während Einlegen, Befüllen und Warten-Synchron;Krs_DNZielMot_Offset_kf;KrsApplSollgradient: ""Applikation Sollgradient für  Drehzahl/Gradientenregler"";eZweidim;eViewText;eBars;eHiLo;0;1;0;0;0;0;5;5;10;;0;0;0;Drehzahl;U/min;1;0;$20C90;Motor/Kupplungsmoment;;Nm;0.05;-0;10;0;0;1;2;eRom;0;$20AA0;eHiLo;0x-1;0;Drehzahl;;U/min;1;0;10;0;0;1;0;eRom;0;$20C86;eHiLo;0x-1;0
Kennfeld zur Bestimmung des P-Beiwerts i.A. von Zielgang und Motormoment fuer die Annaeherungsphase in S/Tip (OPL_2667);Krs_FaktKp_RegNAusreg_STip_kf;KrsApplSollgradient: ""Applikation Sollgradient für  Drehzahl/Gradientenregler"";eZweidim;eViewText;eBars;eHiLo;0;1;0;0;0;0;5;6;10;;2;0;0;;;0.01;-0;$20F00;Motor/Kupplungsmoment;;Nm;0.05;-0;10;0;0;1;2;eRom;0;$20AA0;eHiLo;0x-1;0;T_GANG_0_1_6;NO_INPUT_QUANTITY;;1;0;10;0;0;0;0;eUserdefString;0;$0;eByte;0x-1;0
Kennfeld zur Bestimmung des P-Beiwerts i.A. von Zielgang und Motormoment fuer die Annaeherungsphase in D (OPL_2667);Krs_FaktKp_RegNAusreg_kf;KrsApplSollgradient: ""Applikation Sollgradient für  Drehzahl/Gradientenregler"";eZweidim;eViewText;eBars;eHiLo;0;1;0;0;0;0;5;6;10;;2;0;0;;;0.01;-0;$20EC4;Motor/Kupplungsmoment;;Nm;0.05;-0;10;0;0;1;2;eRom;0;$20AA0;eHiLo;0x-1;0;T_GANG_0_1_6;NO_INPUT_QUANTITY;;1;0;10;0;0;0;0;eUserdefString;0;$0;eByte;0x-1;0
Mindestgradient der Fortschrittskontrolle ueber Motormoment ohne Eingriff;Krs_NGrdSollMin_Fort_kl;KrsApplSollgradient: ""Applikation Sollgradient für  Drehzahl/Gradientenregler"";eEindim;eViewText;eBars;eHiLo;0;1;0;0;0;0;5;1;10;;0;0;0;Drehzahlgradient;U/min / sec;1;0;$20EBA;Motor/Kupplungsmoment;;Nm;0.05;-0;10;0;0;1;2;eRom;0;$20E7C;eHiLo;0x-1;0;-;;-;1;0;16;1;0;0;-1;eDataSrcNone;0;$0;eByte;0x-1;0
Verstärkungsfaktor des Drehzahlregler zur Berechnung des Solldrehzahlgradienten ohne Mindesmomentenanforderung;Krs_NpSollNRegKp_kf;KrsApplSollgradient: ""Applikation Sollgradient für  Drehzahl/Gradientenregler"";eZweidim;eViewText;eBars;eHiLo;0;1;0;0;0;0;5;7;10;;1;0;0;;;0.01;-0;$20CC2;Motor/Kupplungsmoment;;Nm;0.05;-0;10;0;0;1;2;eRom;0;$20AA0;eHiLo;0x-1;0;Gang enum;NO_INPUT_QUANTITY;;1;1;10;0;0;0;3;eUserdefString;0;$0;eByte;0x-1;0
