Name;IdName;FolderName;Type;ViewMode;RWin;DataOrg;bReciprocal;bSigned;bDelta;bPercent;bOriginal;bOriginalValues;Columns;Rows;Radix;Comment;Precision;SkipBytes;LineSkipBytes;Fieldvalues.Name;Fieldvalues.Unit;Fieldvalues.Factor;Fieldvalues.Offset;Fieldvalues.StartAddr;AxisX.Name;AxisX.IdName;AxisX.Unit;AxisX.Factor;AxisX.Offset;AxisX.Radix;AxisX.bBackwards;AxisX.bReciprocal;AxisX.bSigned;AxisX.Precision;AxisX.DataSrc;AxisX.DataHeader;AxisX.DataAddr;AxisX.DataOrg;AxisX.SignatureByte;AxisX.SkipBytes;AxisY.Name;AxisY.IdName;AxisY.Unit;AxisY.Factor;AxisY.Offset;AxisY.Radix;AxisY.bBackwards;AxisY.bReciprocal;AxisY.bSigned;AxisY.Precision;AxisY.DataSrc;AxisY.DataHeader;AxisY.DataAddr;AxisY.DataOrg;AxisY.SignatureByte;AxisY.SkipBytes
Schalt-Tabelle 'BERGAB';BGETAB;DSP_Parameter: """";eZweidim;eViewText;eBars;eByte;0;0;0;0;0;0;21;21;10;;0;0;0;1:1 Umrechnung mit Einheit km/h ohne Nachkommastellen;km/h;1;0;$B48F;DSP_Stuetzstellen_21_in_Prozent;;;1;0;10;0;0;0;0;eUserdefString;0;$0;eByte;0x-1;0;DSP_Schaltung_14_erweitert;NO_INPUT_QUANTITY;;1;0;10;0;0;0;0;eUserdefString;0;$0;eByte;0x-1;0
Schalttabelle bei BOOST-Betrieb;BOOSLTAB;DSP_Hybrid: """";eZweidim;eViewText;eBars;eByte;0;0;0;0;0;0;21;21;10;;0;0;0;1:1 Umrechnung mit Einheit km/h ohne Nachkommastellen;km/h;1;0;$CE6A;DSP_Stuetzstellen_21_in_Prozent;;;1;0;10;0;0;0;0;eUserdefString;0;$0;eByte;0x-1;0;DSP_Schaltung_14_erweitert;NO_INPUT_QUANTITY;;1;0;10;0;0;0;0;eUserdefString;0;$0;eByte;0x-1;0
Schalt-Tabelle 'BERGAUF';BSLTAB;DSP_Parameter: """";eZweidim;eViewText;eBars;eByte;0;0;0;0;0;0;21;21;10;;0;0;0;1:1 Umrechnung mit Einheit km/h ohne Nachkommastellen;km/h;1;0;$B2D6;DSP_Stuetzstellen_21_in_Prozent;;;1;0;10;0;0;0;0;eUserdefString;0;$0;eByte;0x-1;0;DSP_Schaltung_14_erweitert;NO_INPUT_QUANTITY;;1;0;10;0;0;0;0;eUserdefString;0;$0;eByte;0x-1;0
Schalt-Tabelle 'CITY';CITYSLTAB;DSP_City_Sport: """";eZweidim;eViewText;eBars;eByte;0;0;0;0;0;0;21;21;10;;0;0;0;1:1 Umrechnung mit Einheit km/h ohne Nachkommastellen;km/h;1;0;$AF64;DSP_Stuetzstellen_21_in_Prozent;;;1;0;10;0;0;0;0;eUserdefString;0;$0;eByte;0x-1;0;DSP_Schaltung_14_erweitert;NO_INPUT_QUANTITY;;1;0;10;0;0;0;0;eUserdefString;0;$0;eByte;0x-1;0
Schalt-Tabelle 'Hybrid Depleting';DEPSLTAB;DSP_Hybrid: """";eZweidim;eViewText;eBars;eByte;0;0;0;0;0;0;21;21;10;;0;0;0;1:1 Umrechnung mit Einheit km/h ohne Nachkommastellen;km/h;1;0;$C786;DSP_Stuetzstellen_21_in_Prozent;;;1;0;10;0;0;0;0;eUserdefString;0;$0;eByte;0x-1;0;DSP_Schaltung_14_erweitert;NO_INPUT_QUANTITY;;1;0;10;0;0;0;0;eUserdefString;0;$0;eByte;0x-1;0
Schalt-Tabelle 'Efficiency-Bergauf';EFFBSLTAB;DSP_Efficiency: ""Werte für Effizienz-Modus"";eZweidim;eViewText;eBars;eByte;0;0;0;0;0;0;21;21;10;;0;0;0;1:1 Umrechnung mit Einheit km/h ohne Nachkommastellen;km/h;1;0;$B805;DSP_Stuetzstellen_21_in_Prozent;;;1;0;10;0;0;0;0;eUserdefString;0;$0;eByte;0x-1;0;DSP_Schaltung_14_erweitert;NO_INPUT_QUANTITY;;1;0;10;0;0;0;0;eUserdefString;0;$0;eByte;0x-1;0
Schalt-Tabelle 'Efficiency-DPF';EFFDPFSLTAB;DSP_Efficiency: ""Werte für Effizienz-Modus"";eZweidim;eViewText;eBars;eByte;0;0;0;0;0;0;21;21;10;;0;0;0;1:1 Umrechnung mit Einheit km/h ohne Nachkommastellen;km/h;1;0;$BEE9;DSP_Stuetzstellen_21_in_Prozent;;;1;0;10;0;0;0;0;eUserdefString;0;$0;eByte;0x-1;0;DSP_Schaltung_14_erweitert;NO_INPUT_QUANTITY;;1;0;10;0;0;0;0;eUserdefString;0;$0;eByte;0x-1;0
Schalt-Tabelle 'Efficiency-Bergab';EFFGESLTAB;DSP_Efficiency: ""Werte für Effizienz-Modus"";eZweidim;eViewText;eBars;eByte;0;0;0;0;0;0;21;21;10;;0;0;0;1:1 Umrechnung mit Einheit km/h ohne Nachkommastellen;km/h;1;0;$B9BE;DSP_Stuetzstellen_21_in_Prozent;;;1;0;10;0;0;0;0;eUserdefString;0;$0;eByte;0x-1;0;DSP_Schaltung_14_erweitert;NO_INPUT_QUANTITY;;1;0;10;0;0;0;0;eUserdefString;0;$0;eByte;0x-1;0
Schalt-Tabelle 'Efficiency-Heiss';EFFHOTSLTAB;DSP_Efficiency: ""Werte für Effizienz-Modus"";eZweidim;eViewText;eBars;eByte;0;0;0;0;0;0;21;21;10;;0;0;0;1:1 Umrechnung mit Einheit km/h ohne Nachkommastellen;km/h;1;0;$BD30;DSP_Stuetzstellen_21_in_Prozent;;;1;0;10;0;0;0;0;eUserdefString;0;$0;eByte;0x-1;0;DSP_Schaltung_14_erweitert;NO_INPUT_QUANTITY;;1;0;10;0;0;0;0;eUserdefString;0;$0;eByte;0x-1;0
Schalt-Tabelle 'Efficiency-Warmlauf';EFFWRMSLTAB;DSP_Efficiency: ""Werte für Effizienz-Modus"";eZweidim;eViewText;eBars;eByte;0;0;0;0;0;0;21;21;10;;0;0;0;1:1 Umrechnung mit Einheit km/h ohne Nachkommastellen;km/h;1;0;$BB77;DSP_Stuetzstellen_21_in_Prozent;;;1;0;10;0;0;0;0;eUserdefString;0;$0;eByte;0x-1;0;DSP_Schaltung_14_erweitert;NO_INPUT_QUANTITY;;1;0;10;0;0;0;0;eUserdefString;0;$0;eByte;0x-1;0
Schalttabelle E-Fahren;ESLTAB;DSP_Hybrid: """";eZweidim;eViewText;eBars;eByte;0;0;0;0;0;0;21;21;10;;0;0;0;1:1 Umrechnung mit Einheit km/h ohne Nachkommastellen;km/h;1;0;$C93F;DSP_Stuetzstellen_21_in_Prozent;;;1;0;10;0;0;0;0;eUserdefString;0;$0;eByte;0x-1;0;DSP_Schaltung_14_erweitert;NO_INPUT_QUANTITY;;1;0;10;0;0;0;0;eUserdefString;0;$0;eByte;0x-1;0
Schalt-Tabelle für 'S' (EXTREM);EXTREMTAB;DSP_Parameter: """";eZweidim;eViewText;eBars;eByte;0;0;0;0;0;0;21;21;10;;0;0;0;1:1 Umrechnung mit Einheit km/h ohne Nachkommastellen;km/h;1;0;$B11D;DSP_Stuetzstellen_21_in_Prozent;;;1;0;10;0;0;0;0;eUserdefString;0;$0;eByte;0x-1;0;DSP_Schaltung_14_erweitert;NO_INPUT_QUANTITY;;1;0;10;0;0;0;0;eUserdefString;0;$0;eByte;0x-1;0
Oberhalb dieser ATF-Grenze wird die Funktion wieder abgeschaltet;EXTREM_KALT_AUS;DSP_extrem_kalt: ""Verhinderung des 1. Gangs bei Tiefen Temperaturen"";eEinzel;eViewText;eBars;eByte;0;0;0;0;0;0;1;1;10;;0;0;0;Umrechnungsformel für die ATF-Temperatur;°C;1;-55;$B803;-;;-;1;0;16;1;0;0;-1;eDataSrcNone;0;$0;eByte;0x-1;0;-;;-;1;0;16;1;0;0;-1;eDataSrcNone;0;$0;eByte;0x-1;0
Unterhalb dieser ATF-Grenze wird die Funktion eingeschaltet;EXTREM_KALT_EIN;DSP_extrem_kalt: ""Verhinderung des 1. Gangs bei Tiefen Temperaturen"";eEinzel;eViewText;eBars;eByte;0;0;0;0;0;0;1;1;10;;0;0;0;Umrechnungsformel für die ATF-Temperatur;°C;1;-55;$B802;-;;-;1;0;16;1;0;0;-1;eDataSrcNone;0;$0;eByte;0x-1;0;-;;-;1;0;16;1;0;0;-1;eDataSrcNone;0;$0;eByte;0x-1;0
1: Bei sehr niedrigen Temperaturen wird der 1.Gang gesperrt und im 2. Gang gefahren;EXTREM_KALT_ENABLE;DSP_extrem_kalt: ""Verhinderung des 1. Gangs bei Tiefen Temperaturen"";eEinzel;eViewText;eBars;eByte;0;0;0;0;0;0;1;1;10;;0;0;0;;;1;0;$B801;-;;-;1;0;16;1;0;0;-1;eDataSrcNone;0;$0;eByte;0x-1;0;-;;-;1;0;16;1;0;0;-1;eDataSrcNone;0;$0;eByte;0x-1;0
1: bei Temperaturfehler im 1.Gang starten, Funktion ist quasi aus;EXTREM_KALT_IM_FEHLERFALL_MIT_G1;DSP_extrem_kalt: ""Verhinderung des 1. Gangs bei Tiefen Temperaturen"";eEinzel;eViewText;eBars;eByte;0;0;0;0;0;0;1;1;10;;0;0;0;;;1;0;$B804;-;;-;1;0;16;1;0;0;-1;eDataSrcNone;0;$0;eByte;0x-1;0;-;;-;1;0;16;1;0;0;-1;eDataSrcNone;0;$0;eByte;0x-1;0
Schalttabelle Hybrid E-Fahren Boosten;E_FELD_BOOST;DSP_Hybrid: """";eZweidim;eViewText;eBars;eByte;0;0;0;0;0;0;21;21;10;;0;0;0;1:1 Umrechnung mit Einheit km/h ohne Nachkommastellen;km/h;1;0;$CAF8;DSP_Stuetzstellen_21_in_Prozent;;;1;0;10;0;0;0;0;eUserdefString;0;$0;eByte;0x-1;0;DSP_Schaltung_14_erweitert;NO_INPUT_QUANTITY;;1;0;10;0;0;0;0;eUserdefString;0;$0;eByte;0x-1;0
Schalttabelle Hybrid E-Fahren Rekuperation;E_FELD_REKUP;DSP_Hybrid: """";eZweidim;eViewText;eBars;eByte;0;0;0;0;0;0;21;21;10;;0;0;0;1:1 Umrechnung mit Einheit km/h ohne Nachkommastellen;km/h;1;0;$CCB1;DSP_Stuetzstellen_21_in_Prozent;;;1;0;10;0;0;0;0;eUserdefString;0;$0;eByte;0x-1;0;DSP_Schaltung_14_erweitert;NO_INPUT_QUANTITY;;1;0;10;0;0;0;0;eUserdefString;0;$0;eByte;0x-1;0
Schalt-Tabelle 'HEISS';HOTSLTAB;DSP_Parameter: """";eZweidim;eViewText;eBars;eByte;0;0;0;0;0;0;21;21;10;;0;0;0;1:1 Umrechnung mit Einheit km/h ohne Nachkommastellen;km/h;1;0;$B648;DSP_Stuetzstellen_21_in_Prozent;;;1;0;10;0;0;0;0;eUserdefString;0;$0;eByte;0x-1;0;DSP_Schaltung_14_erweitert;NO_INPUT_QUANTITY;;1;0;10;0;0;0;0;eUserdefString;0;$0;eByte;0x-1;0
Offroad Schalt-Tabelle Bergauf;OTSBSLTAB;DSP_Offroad: ""Funktionen für den Offroadtaster"";eZweidim;eViewText;eBars;eByte;0;0;0;0;0;0;21;21;10;;0;0;0;1:1 Umrechnung mit Einheit km/h ohne Nachkommastellen;km/h;1;0;$C25B;DSP_Stuetzstellen_21_in_Prozent;;;1;0;10;0;0;0;0;eUserdefString;0;$0;eByte;0x-1;0;DSP_Schaltung_14_erweitert;NO_INPUT_QUANTITY;;1;0;10;0;0;0;0;eUserdefString;0;$0;eByte;0x-1;0
Offroad Schalt-Tabelle Bergab;OTSGESLTAB;DSP_Offroad: ""Funktionen für den Offroadtaster"";eZweidim;eViewText;eBars;eByte;0;0;0;0;0;0;21;21;10;;0;0;0;1:1 Umrechnung mit Einheit km/h ohne Nachkommastellen;km/h;1;0;$C414;DSP_Stuetzstellen_21_in_Prozent;;;1;0;10;0;0;0;0;eUserdefString;0;$0;eByte;0x-1;0;DSP_Schaltung_14_erweitert;NO_INPUT_QUANTITY;;1;0;10;0;0;0;0;eUserdefString;0;$0;eByte;0x-1;0
Offroad Schalt-Tabelle;OTSSLTAB;DSP_Offroad: ""Funktionen für den Offroadtaster"";eZweidim;eViewText;eBars;eByte;0;0;0;0;0;0;21;21;10;;0;0;0;1:1 Umrechnung mit Einheit km/h ohne Nachkommastellen;km/h;1;0;$C0A2;DSP_Stuetzstellen_21_in_Prozent;;;1;0;10;0;0;0;0;eUserdefString;0;$0;eByte;0x-1;0;DSP_Schaltung_14_erweitert;NO_INPUT_QUANTITY;;1;0;10;0;0;0;0;eUserdefString;0;$0;eByte;0x-1;0
Schalt-Tabelle 'ECO';SLTAB;DSP_Parameter: """";eZweidim;eViewText;eBars;eByte;0;0;0;0;0;0;21;21;10;;0;0;0;1:1 Umrechnung mit Einheit km/h ohne Nachkommastellen;km/h;1;0;$ABF2;DSP_Stuetzstellen_21_in_Prozent;;;1;0;10;0;0;0;0;eUserdefString;0;$0;eByte;0x-1;0;DSP_Schaltung_14_erweitert;NO_INPUT_QUANTITY;;1;0;10;0;0;0;0;eUserdefString;0;$0;eByte;0x-1;0
Schalt-Tabelle hoher Sportlichkeitfaktor (SPORT);SLTABX;DSP_Parameter: """";eZweidim;eViewText;eBars;eByte;0;0;0;0;0;0;21;21;10;;0;0;0;1:1 Umrechnung mit Einheit km/h ohne Nachkommastellen;km/h;1;0;$ADAB;DSP_Stuetzstellen_21_in_Prozent;;;1;0;10;0;0;0;0;eUserdefString;0;$0;eByte;0x-1;0;DSP_Schaltung_14_erweitert;NO_INPUT_QUANTITY;;1;0;10;0;0;0;0;eUserdefString;0;$0;eByte;0x-1;0
Schalt-Tabelle 'SNOW';SNOWSLTAB;DSP_Parameter: """";eZweidim;eViewText;eBars;eByte;0;0;0;0;0;0;21;21;10;;0;0;0;1:1 Umrechnung mit Einheit km/h ohne Nachkommastellen;km/h;1;0;$C5CD;DSP_Stuetzstellen_21_in_Prozent;;;1;0;10;0;0;0;0;eUserdefString;0;$0;eByte;0x-1;0;DSP_Schaltung_14_erweitert;NO_INPUT_QUANTITY;;1;0;10;0;0;0;0;eUserdefString;0;$0;eByte;0x-1;0
Schaltzeiten mit Momentenreduktion bei aktivierter Eek-Funktionalität;KhsEek_MRedTSchalt_kl;KhsApplEek: ""Applikationsparameter für die Eek-Funktionalität"";eZweidim;eViewText;eBars;eHiLo;0;1;0;0;0;0;5;6;10;;1;0;0;;ms;1;0;$18438;Fahrpedalachse;;%;0.1;-0;10;0;0;1;1;eRom;0;$18310;eHiLo;0x-1;0;Gänge Hochschaltung;Khs.GangLetzt;;1;1;10;0;0;0;0;eUserdefString;0;$0;eByte;0x-1;0
Prozentuale Verteilung des Reglermoments auf die kommende Kupplung in Abhaengigkeit des Moments der gehenden Kupplung;KhsFaktRegelKommend_kl;KhsApplUeberschneidung: ""Applikationsgrößen für die Überschneidung"";eEindim;eViewText;eBars;eHiLo;0;1;0;0;0;0;4;1;10;;1;0;0;;%;0.09765625;-0;$18696;Kennlinienachse Prozentuale Verteilung des Reglermoments auf die kommende Kupplung in Abhaengigkeit des Moments der gehenden Kupplung;;%;0.09765625;-0;10;0;0;1;1;eRom;2;$1868E;eHiLo;0x2;0;-;;-;1;0;16;1;0;0;-1;eDataSrcNone;0;$0;eByte;0x6600;0
Einschalter fuer Temperaturkorrektur des I-Anteils (OPL_2922);KhsGr_En_KiTempKorr_ko;KhsApplReg: ""Applikationsgrößen für den Regler"";eEinzel;eViewText;eBars;eByte;0;0;0;0;0;0;1;1;10;;0;0;0;0: Nein, 1: Ja;;1;0;$18683;-;;-;1;0;16;1;0;0;-1;eDataSrcNone;0;$0;eByte;0x-1;0;-;;-;1;0;16;1;0;0;-1;eDataSrcNone;0;$0;eByte;0x-1;0
Kennlinie fuer Temperaturkorrektur des I-Anteils (OPL_2922);KhsGr_FaktKi_KiTempKorr_kl;KhsApplReg: ""Applikationsgrößen für den Regler"";eEindim;eViewText;eBars;eHiLo;0;1;0;0;0;0;4;1;10;;3;0;0;Aufloesung 0.001 ohne Einheit;;0.001;-0;$18618;Temperatur;;°C;1;0;10;0;0;1;0;eRom;0;$18610;eHiLo;0x-1;0;-;;-;1;0;16;1;0;0;-1;eDataSrcNone;0;$0;eByte;0x-1;0
Verstärkung des I-Reglers bei RoughRoad;KhsGr_Ki_RRD_kl;KhsApplReg: ""Applikationsgrößen für den Regler"";eEindim;eViewText;eBars;eHiLo;0;1;0;0;0;0;5;1;10;;1;0;0;;;0.0001;-0;$18424;Fahrpedalachse bei RRD;;%;0.1;-0;10;0;0;1;1;eRom;0;$18310;eHiLo;0x-1;0;-;;-;1;0;16;1;0;0;-1;eDataSrcNone;0;$0;eByte;0x-1;0
Verstärkung I-Regler des Gradientenreglers;KhsGr_Ki_kl;KhsApplReg: ""Applikationsgrößen für den Regler"";eEindim;eViewText;eBars;eHiLo;0;1;0;0;0;0;5;1;10;;1;0;0;;;0.0001;-0;$1841A;Fahrpedalachse;;%;0.1;-0;10;0;0;1;1;eRom;0;$18310;eHiLo;0x-1;0;-;;-;1;0;16;1;0;0;-1;eDataSrcNone;0;$0;eByte;0x-1;0
Schaltzeiten in D (Eco) mit Momentenreduktion abhängig von der Zieldrehzahl;KhsMRedTSchaltEco_NZiel_kl;KhsApplSchaltzeit: ""Applikationsparameter für die Schaltzeiten"";eZweidim;eViewText;eBars;eHiLo;0;1;0;0;0;0;5;6;10;;1;0;0;;ms;1;0;$184BA;Drehzahl;;U/min;1;0;10;0;0;1;0;eRom;0;$18474;eHiLo;0x-1;0;Gänge Hochschaltung;Khs.GangLetzt;;1;1;10;0;0;0;0;eUserdefString;0;$0;eByte;0x-1;0
Schaltzeiten in D (Eco) mit Momentenreduktion abhängig vom Fahrpedal;KhsMRedTSchaltEco_kl;KhsApplSchaltzeit: ""Applikationsparameter für die Schaltzeiten"";eZweidim;eViewText;eBars;eHiLo;0;1;0;0;0;0;5;6;10;;1;0;0;;ms;1;0;$1831A;Fahrpedalachse;;%;0.1;-0;10;0;0;1;1;eRom;0;$18310;eHiLo;0x-1;0;Gänge Hochschaltung;Khs.GangLetzt;;1;1;10;0;0;0;0;eUserdefString;0;$0;eByte;0x-1;0
Schaltzeiten in D (Eco) mit Momentenreduktion bei RoughRoad;KhsMRedTSchaltRrd_kl;KhsApplSchaltzeit: ""Applikationsparameter für die Schaltzeiten"";eZweidim;eViewText;eBars;eHiLo;0;1;0;0;0;0;5;6;10;;1;0;0;;ms;1;0;$183CE;Fahrpedalachse bei RRD;;%;0.1;-0;10;0;0;1;1;eRom;0;$18310;eHiLo;0x-1;0;Gänge Hochschaltung;Khs.GangLetzt;;1;1;10;0;0;0;0;eUserdefString;0;$0;eByte;0x-1;0
Schaltzeiten in S (Sport) mit Momentenreduktion abhängig von der Zieldrehzahl;KhsMRedTSchaltSport_NZiel_kl;KhsApplSchaltzeit: ""Applikationsparameter für die Schaltzeiten"";eZweidim;eViewText;eBars;eHiLo;0;1;0;0;0;0;5;6;10;;1;0;0;;ms;1;0;$184F6;Drehzahl;;U/min;1;0;10;0;0;1;0;eRom;0;$18474;eHiLo;0x-1;0;Gänge Hochschaltung;Khs.GangLetzt;;1;1;10;0;0;0;0;eUserdefString;0;$0;eByte;0x-1;0
Schaltzeiten in S (Sport) mit Momentenreduktion abhängig vom Fahrpedal;KhsMRedTSchaltSport_kl;KhsApplSchaltzeit: ""Applikationsparameter für die Schaltzeiten"";eZweidim;eViewText;eBars;eHiLo;0;1;0;0;0;0;5;6;10;;1;0;0;;ms;1;0;$18356;Fahrpedalachse;;%;0.1;-0;10;0;0;1;1;eRom;0;$18310;eHiLo;0x-1;0;Gänge Hochschaltung;Khs.GangLetzt;;1;1;10;0;0;0;0;eUserdefString;0;$0;eByte;0x-1;0
Schaltzeiten in Tiptronic mit Momentenreduktion abhängig von der Zieldrehzahl;KhsMRedTSchaltTip_NZiel_kl;KhsApplSchaltzeit: ""Applikationsparameter für die Schaltzeiten"";eZweidim;eViewText;eBars;eHiLo;0;1;0;0;0;0;5;6;10;;1;0;0;;ms;1;0;$1847E;Drehzahl;;U/min;1;0;10;0;0;1;0;eRom;0;$18474;eHiLo;0x-1;0;Gänge Hochschaltung;Khs.GangLetzt;;1;1;10;0;0;0;0;eUserdefString;0;$0;eByte;0x-1;0
Schaltzeiten in Tiptronic mit Momentenreduktion abhängig vom Fahrpedal;KhsMRedTSchaltTip_kl;KhsApplSchaltzeit: ""Applikationsparameter für die Schaltzeiten"";eZweidim;eViewText;eBars;eHiLo;0;1;0;0;0;0;5;6;10;;1;0;0;;ms;1;0;$18392;Fahrpedalachse;;%;0.1;-0;10;0;0;1;1;eRom;0;$18310;eHiLo;0x-1;0;Gänge Hochschaltung;Khs.GangLetzt;;1;1;10;0;0;0;0;eUserdefString;0;$0;eByte;0x-1;0
Auswahlschalter für Interpolationsart der Schaltzeit mit Momentenreduktion in Eco;KhsMRedTSchalt_Auswahlmaske_ko.Eco;KhsApplSchaltzeit: ""Applikationsparameter für die Schaltzeiten"";eZweidim;eViewText;eBars;eBitLoHi;0;0;0;0;0;0;1;1;10;;0;0;0;;;1;0;$1856F;-;;-;1;0;16;1;0;0;-1;eDataSrcNone;0;$0;eByte;0x-1;0;-;;-;1;0;16;1;0;0;-1;eDataSrcNone;0;$0;eByte;0x-1;0
Auswahlschalter für Interpolationsart der Schaltzeit mit Momentenreduktion in Sport;KhsMRedTSchalt_Auswahlmaske_ko.Sport;KhsApplSchaltzeit: ""Applikationsparameter für die Schaltzeiten"";eZweidim;eViewText;eBars;eBitLoHi;0;0;0;0;0;0;1;1;10;;0;0;0;;;2;0;$1856F;-;;-;1;0;16;1;0;0;-1;eDataSrcNone;0;$0;eByte;0x-1;0;-;;-;1;0;16;1;0;0;-1;eDataSrcNone;0;$0;eByte;0x-1;0
Auswahlschalter für Interpolationsart der Schaltzeit mit Momentenreduktion in Tip;KhsMRedTSchalt_Auswahlmaske_ko.Tip;KhsApplSchaltzeit: ""Applikationsparameter für die Schaltzeiten"";eZweidim;eViewText;eBars;eBitLoHi;0;0;0;0;0;0;1;1;10;;0;0;0;;;4;0;$1856F;-;;-;1;0;16;1;0;0;-1;eDataSrcNone;0;$0;eByte;0x-1;0;-;;-;1;0;16;1;0;0;-1;eDataSrcNone;0;$0;eByte;0x-1;0
Auswahlschalter fuer die Aktivierung der Schaltart-abhaengigen max. Motormomentenreduktion;KhsMRed_Modus_RedMaxSchaltart_ko;KhsApplMRed: ""Applikationsparameter für Momentenreduktion der Hochschaltung"";eEinzel;eViewText;eBars;eByte;0;0;0;0;0;0;1;1;10;;3;0;0;Wert 0 = Aus /  Wert 1 = Ein;;1;0;$18156;-;;-;1;0;16;1;0;0;-1;eDataSrcNone;0;$0;eByte;0x-1;0;-;;-;1;0;16;1;0;0;-1;eDataSrcNone;0;$0;eByte;0x-1;0
Mindest Moment der Gehenden am Ende der schnellen Überschneidung, ganghängig.;KhsSU_MKupMin_Gehend_ko;KhsApplUeberschnSchnell: ""Applikationsgrößen für die schnelle Überschneidung"";eEindim;eViewText;eBars;eHiLo;0;1;0;0;0;0;6;1;10;;2;0;0;Motor/Kupplungsmoment;Nm;0.05;-0;$18620;T_GANG_0_1_6;;;1;0;10;0;0;0;0;eUserdefString;0;$0;eByte;0x-1;0;-;;-;1;0;16;1;0;0;-1;eDataSrcNone;0;$0;eByte;0x-1;0
Momenten-Offset auf Gehende Kupplung für Momentenschwelle zum Abbruch nach Befüllen;KhsSU_MKupOfs_GehendeAbbr2Bef_kl;KhsApplUeberschnSchnell: ""Applikationsgrößen für die schnelle Überschneidung"";eEindim;eViewText;eBars;eHiLo;0;1;0;0;0;0;4;1;10;;2;0;0;Motor/Kupplungsmoment;Nm;0.05;-0;$18608;Kennachse für Anlegegrad Kupplung;;;1;0;10;0;0;1;0;eRom;0;$18590;eHiLo;0x-1;0;-;;-;1;0;16;1;0;0;-1;eDataSrcNone;0;$0;eByte;0x-1;0
Mindestmomentgrenze des Motors bei schneller Ueberschneidung (OPL_2850);KhsSU_MMotMin_Begrenzung_ko;KhsApplUeberschnSchnell: ""Applikationsgrößen für die schnelle Überschneidung"";eEinzel;eViewText;eBars;eHiLo;0;1;0;0;0;0;1;1;10;;2;0;0;Motor/Kupplungsmoment;Nm;0.05;-0;$1867E;-;;-;1;0;16;1;0;0;-1;eDataSrcNone;0;$0;eByte;0x-1;0;-;;-;1;0;16;1;0;0;-1;eDataSrcNone;0;$0;eByte;0x-1;0
Var.1: Das Moment der Gehenden fruehzeitig herausfahren.;KhsSU_Mask_EnableAnlegenMitKal2_ko.AbbauGehVar1;KhsApplUeberschnSchnell: ""Applikationsgrößen für die schnelle Überschneidung"";eZweidim;eViewText;eBars;eBitLoHi;0;0;0;0;0;0;1;1;10;;0;0;0;Wert 0 = Aus /  Wert 1 = Ein;;8;0;$18680;-;;-;1;0;16;1;0;0;-1;eDataSrcNone;0;$0;eByte;0x-1;0;-;;-;1;0;16;1;0;0;-1;eDataSrcNone;0;$0;eByte;0x-1;0
Auswahlschalter in Tip fuer die prinzipielle Wahl des Befuellvorganges;KhsSU_Mask_EnableAnlegenMitKal2_ko.BefKal2Enable;KhsApplUeberschnSchnell: ""Applikationsgrößen für die schnelle Überschneidung"";eZweidim;eViewText;eBars;eBitLoHi;0;0;0;0;0;0;1;1;10;;0;0;0;;;1;0;$18680;-;;-;1;0;16;1;0;0;-1;eDataSrcNone;0;$0;eByte;0x-1;0;-;;-;1;0;16;1;0;0;-1;eDataSrcNone;0;$0;eByte;0x-1;0
Auswahlschalter ermoeglicht die Verwendung eines eigenen gangabhaengigen Faktors auf das Ueberschneidungsmoment, wenn die kommende Kupplung bereits vorbefuellt ist. (OPL_2832);KhsSU_Mask_EnableAnlegenMitKal2_ko.FaktUeVorbefExtra;KhsApplUeberschnSchnell: ""Applikationsgrößen für die schnelle Überschneidung"";eZweidim;eViewText;eBars;eBitLoHi;0;0;0;0;0;0;1;1;10;;0;0;0;Umrechnungsregel fuer Auswahl Kennlinie bei vorbefuellter Kupplung;;16;0;$18680;-;;-;1;0;16;1;0;0;-1;eDataSrcNone;0;$0;eByte;0x-1;0;-;;-;1;0;16;1;0;0;-1;eDataSrcNone;0;$0;eByte;0x-1;0
"Auswahlschalter fuer die Verwendung des Effektiven Befuellgrades bei der Berechnung des Ueberschneidungsmomentes; sonst wird der normale Befuellgrad verwendet (OPL_2831)";KhsSU_Mask_EnableAnlegenMitKal2_ko.Kal2AnlegegradEff;KhsApplUeberschnSchnell: ""Applikationsgrößen für die schnelle Überschneidung"";eZweidim;eViewText;eBars;eBitLoHi;0;0;0;0;0;0;1;1;10;;0;0;0;Umrechnungsregel fuer Auswahl des zu verwendenden Befuellgrades;;4;0;$18680;-;;-;1;0;16;1;0;0;-1;eDataSrcNone;0;$0;eByte;0x-1;0;-;;-;1;0;16;1;0;0;-1;eDataSrcNone;0;$0;eByte;0x-1;0
Auswahlschalter für das Offenmoment der gehenden Kupplung bei schneller Überschneidung;KhsSU_Mask_EnableAnlegenMitKal2_ko.MKupOffenGeh;KhsApplUeberschnSchnell: ""Applikationsgrößen für die schnelle Überschneidung"";eZweidim;eViewText;eBars;eBitLoHi;0;0;0;0;0;0;1;1;10;;0;0;0;;;2;0;$18680;-;;-;1;0;16;1;0;0;-1;eDataSrcNone;0;$0;eByte;0x-1;0;-;;-;1;0;16;1;0;0;-1;eDataSrcNone;0;$0;eByte;0x-1;0
Drehzahldelta um welches sich der Motor während der schnellen Überschneidung schon gelöst haben muss, damit nach Warten Synchron abgebrochen wird (frühestens nach KhsSU_TiMaxDeltaN_Abbruch_ko).;KhsSU_NDeltaMax_Abbruch_ko;KhsApplUeberschnSchnell: ""Applikationsgrößen für die schnelle Überschneidung"";eEinzel;eViewText;eBars;eHiLo;0;1;0;0;0;0;1;1;10;;0;0;0;Drehzahl;U/min;1;0;$1862E;-;;-;1;0;16;1;0;0;-1;eDataSrcNone;0;$0;eByte;0x-1;0;-;;-;1;0;16;1;0;0;-1;eDataSrcNone;0;$0;eByte;0x-1;0
Korrekturfaktor auf das aus der Gehenden herauszufahrende Moment, gangabhaengiger Einfluss und Temperaturkompensation (OPL_2567, OPL_2832);KhsSU_Prz_FaktAusGangTemp_kl.Standard;KhsApplUeberschnSchnell: ""Applikationsgrößen für die schnelle Überschneidung"";eZweidim;eViewText;eBars;eHiLo;0;1;0;0;0;0;3;6;10;;0;0;0;Prozentwert in 100/1024;%;0.09765625;-0;$18636;Temperatur;;°C;1;0;10;0;0;1;0;eRom;0;$18630;eHiLo;0x-1;0;Gänge Hochschaltung;NO_INPUT_QUANTITY;;1;1;10;0;0;0;0;eUserdefString;0;$0;eByte;0x-1;0
Korrekturfaktor auf das aus der Gehenden herauszufahrende Moment, gangabhaengiger Einfluss und Temperaturkompensation bei vorbefuellter Kupplung (OPL_2832);KhsSU_Prz_FaktAusGangTemp_kl.Vorbef;KhsApplUeberschnSchnell: ""Applikationsgrößen für die schnelle Überschneidung"";eZweidim;eViewText;eBars;eHiLo;0;1;0;0;0;0;3;6;10;;0;0;0;Prozentwert in 100/1024;%;0.09765625;-0;$1865A;Temperatur;;°C;1;0;10;0;0;1;0;eRom;0;$18630;eHiLo;0x-1;0;Gänge Hochschaltung;NO_INPUT_QUANTITY;;1;1;10;0;0;0;0;eUserdefString;0;$0;eByte;0x-1;0
Faktor, mit dem die Momenten-Reduzierung auf der Gehenden Kupplung schwächer vorgenommen wird, abhängig vom Motormoment und Motordrehzahl.;KhsSU_Prz_FaktAusNAnMMot_kf;KhsApplUeberschnSchnell: ""Applikationsgrößen für die schnelle Überschneidung"";eZweidim;eViewText;eBars;eHiLo;0;1;0;0;0;0;4;4;10;;0;0;0;Prozentwert in 100/1024;%;0.09765625;-0;$185D0;Drehzahl;;U/min;1;0;10;0;0;1;0;eRom;0;$185C8;eHiLo;0x-1;0;Motor/Kupplungsmoment;;Nm;0.05;-0;10;0;0;1;2;eRom;0;$185F0;eHiLo;0x-1;0
Faktor, mit dem die Momenten-Reduzierung auf der Gehenden Kupplung schwächer vorgenommen wird, wenn Schlupf auf der Kupplung ist.;KhsSU_Prz_FaktAusSchlupfGeh_kl;KhsApplUeberschnSchnell: ""Applikationsgrößen für die schnelle Überschneidung"";eEindim;eViewText;eBars;eHiLo;0;1;0;0;0;0;4;1;10;;0;0;0;Prozentwert in 100/1024;%;0.09765625;-0;$1860A;Drehzahl;;U/min;1;0;10;0;0;1;0;eRom;2;$18602;eHiLo;0xC800;0;-;;-;1;0;16;1;0;0;-1;eDataSrcNone;0;$0;eByte;0x1400;0
Faktor für kommende Kupplung für berechnetes Überschneidungsmoment;KhsSU_Prz_FaktGesamtKommend_ko;KhsApplUeberschnSchnell: ""Applikationsgrößen für die schnelle Überschneidung"";eEinzel;eViewText;eBars;eByte;0;0;0;0;0;0;1;1;10;;1;0;0;;%;0.78125;-0;$18681;-;;-;1;0;16;1;0;0;-1;eDataSrcNone;0;$0;eByte;0x-1;0;-;;-;1;0;16;1;0;0;-1;eDataSrcNone;0;$0;eByte;0x-1;0
Faktor, mit dem die kommende Kupplung über das Motormoment hinaus angesteuert werden kann.;KhsSU_Prz_FaktMKupUebMMot4Trag_kl;KhsApplUeberschnSchnell: ""Applikationsgrößen für die schnelle Überschneidung"";eEindim;eViewText;eBars;eHiLo;0;1;0;0;0;0;4;1;10;;0;0;0;Prozentwert in 100/1024;%;0.09765625;-0;$185C0;Prozentwert in 100/1024;;%;0.09765625;-0;10;0;0;1;0;eRom;0;$18598;eHiLo;0x-1;0;-;;-;1;0;16;1;0;0;-1;eDataSrcNone;0;$0;eByte;0x-1;0
Faktor mit dem die Momentenübertragung von der Gehenden auf die Kommende Kupplung bezüglich des Befüllgrades gesteuert wird.  Der Faktor kann für verschiedene (geschätzte) Tragfähigkeiten der Kommenden Kupplung gewichtet werden.;KhsSU_Prz_FaktRelTragfKom_kf;KhsApplUeberschnSchnell: ""Applikationsgrößen für die schnelle Überschneidung"";eZweidim;eViewText;eBars;eHiLo;0;1;0;0;0;0;4;4;10;;0;0;0;Prozentwert in 100/1024;%;0.09765625;-0;$185A0;Kennachse für Anlegegrad Kupplung;;;1;0;10;0;0;1;0;eRom;0;$18590;eHiLo;0x-1;0;Prozentwert in 100/1024;;%;0.09765625;-0;10;0;0;1;0;eRom;0;$18598;eHiLo;0x-1;0
Ersatzfaktor für die relative Tragfähigkeit der kommenden Kupplung, wenn der Drucksensor als NICHT MEHR vertrauenswürdig gesetzt ist.;KhsSU_Prz_P2P4MMot_ErsatzProz_ko;KhsApplUeberschnSchnell: ""Applikationsgrößen für die schnelle Überschneidung"";eEinzel;eViewText;eBars;eHiLo;0;1;0;0;0;0;1;1;10;;0;0;0;Prozentwert in 100/1024;%;0.09765625;-0;$1862C;-;;-;1;0;16;1;0;0;-1;eDataSrcNone;0;$0;eByte;0x-1;0;-;;-;1;0;16;1;0;0;-1;eDataSrcNone;0;$0;eByte;0x-1;0
"Wieviel Prozent des Drucks (M_Kup = M_Mot) werden bezüglich des Befüllgrades erwartet?; kann als Kennfeld für verschiedene Moment aufgespannt werden.";KhsSU_Prz_P2P4MMot_Norm_kf;KhsApplUeberschnSchnell: ""Applikationsgrößen für die schnelle Überschneidung"";eZweidim;eViewText;eBars;eHiLo;0;1;0;0;0;0;4;4;10;;0;0;0;Prozentwert in 100/1024;%;0.09765625;-0;$18570;Kennachse für Anlegegrad Kupplung;;;1;0;10;0;0;1;0;eRom;0;$18590;eHiLo;0x-1;0;Motor/Kupplungsmoment;;Nm;0.05;-0;10;0;0;1;2;eRom;0;$185F0;eHiLo;0x-1;0
Maximale Zeit in der schnellen Überschneidung ab der nach Warten Synchron abgebrochen wird wenn sich der Motor schon gelöst hat (KhsSU_NDeltaMax_Abbruch_ko).;KhsSU_TiMaxDeltaN_Abbruch_ko;KhsApplUeberschnSchnell: ""Applikationsgrößen für die schnelle Überschneidung"";eEinzel;eViewText;eBars;eByte;0;0;0;0;0;0;1;1;10;;0;0;0;ms bezogen auf 10ms Zeitscheibe;ms;10;-0;$18682;-;;-;1;0;16;1;0;0;-1;eDataSrcNone;0;$0;eByte;0x-1;0;-;;-;1;0;16;1;0;0;-1;eDataSrcNone;0;$0;eByte;0x-1;0
Schaltzeit für Amax Schaltungen (Gradientenregler) abhängig von MMotOE, wird in Abhängigkeit von Khs_Modus_TSchaltSchub_ko verwendet;KhsTSchaltAFzgMax_kl;KhsApplSchaltzeit: ""Applikationsparameter für die Schaltzeiten"";eZweidim;eViewText;eBars;eHiLo;0;1;0;0;0;0;5;6;10;;1;0;0;;ms;1;0;$18532;Motor/Kupplungsmoment;;Nm;0.05;-0;10;0;0;1;2;eRom;0;$1842E;eHiLo;0x-1;0;Gänge Hochschaltung;NO_INPUT_QUANTITY;;1;1;10;0;0;0;0;eUserdefString;0;$0;eByte;0x-1;0
